{"answers":{"department":{"choice":"technical","confidence":null,"probabilities":{"billing":0.1,"sales":0.05,"technical":0.85},"type":"choice"},"frustration":{"confidence":null,"level":"Frustrated","levels":["Calm","Frustrated","Very angry"],"probabilities":[0.05,0.85,0.1],"score":1.05,"type":"score"},"refund":{"probability":0.08,"type":"noul"}},"backend":"jev","id":"example-t01","model":"jev-example","produced_by":{"name":"jevdecision","version":"0.1.0"},"questions":{"department":{"criteria":{"billing":"Payments, invoicing, refunds","sales":"Pricing, upgrades, new accounts","technical":"Bugs, outages, integrations"},"instructions":"Which team should handle this?","type":"choice"},"frustration":{"criteria":["Calm","Frustrated","Very angry"],"instructions":"How frustrated is the customer?","type":"score"},"refund":{"instructions":"Is the customer angry?","type":"noul"}},"record_sha256":"99399bba91efc89e7087b10731261a2db27e69c9091ad302b7adc84c9d77241a","response":{"answers":{"department":{"choice":"technical","probabilities":{"billing":0.1,"sales":0.05,"technical":0.85},"type":"choice"},"frustration":{"probabilities":{"0":0.05,"1":0.85,"2":0.1},"score":1.05,"type":"score"},"refund":{"noul":0.08,"type":"noul"}},"id":"example-t01","model":"jev-example"},"schema_version":2,"usage":{}}
