{"answers":{"department":{"choice":"technical","confidence":null,"probabilities":{"billing":0.08,"sales":0.07,"technical":0.85},"type":"choice"},"frustration":{"confidence":null,"level":"Frustrated","levels":["Calm","Frustrated","Very angry"],"probabilities":[0,1,0],"score":1,"type":"score"},"refund":{"probability":0.12,"type":"noul"}},"backend":"openai","id":"example-openai-1","model":"decisions-example","produced_by":{"name":"jevdecision","version":"0.1.0"},"questions":{"department":{"criteria":{"billing":"Payments, invoicing, refunds","sales":"Pricing, upgrades, new accounts","technical":"Bugs, outages, integrations"},"instructions":"Which team should handle this?","type":"choice"},"frustration":{"criteria":["Calm","Frustrated","Very angry"],"instructions":"How frustrated is the customer?","type":"score"},"refund":{"instructions":"Is the customer asking for a refund?","type":"noul"}},"record_sha256":"c0b50eb8afbf3204a671ae2a4f36d956569bcb64d95acdd31c5f6e83c7a17c37","response":{"answers":[{"name":"refund","probability":0.12,"type":"predicate"},{"name":"department","probabilities":[{"probability":0.08,"value":"billing"},{"probability":0.85,"value":"technical"},{"probability":0.07,"value":"sales"}],"type":"choice","value":"technical"},{"name":"frustration","probabilities":[{"label":"Calm","probability":0},{"label":"Frustrated","probability":1},{"label":"Very angry","probability":0}],"score":1,"type":"score"}],"id":"example-openai-1","model":"decisions-example","usage":{"total_tokens":7}},"schema_version":2,"usage":{"total_tokens":7}}
