{"answers":{"rare":{"probability":5e-324,"type":"noul"},"refund":{"type":"refusal"},"tone":{"choice":"a","confidence":null,"probabilities":{"a":0.5,"é":0.25,"€":0.125,"😀":0.0625,"דּ":0.0625},"type":"choice"},"urgency":{"confidence":null,"level":"high","levels":["low","high"],"probabilities":[1e-7,0.9999999],"score":1,"type":"score"}},"backend":"jev","id":"example-canon-1","model":"jev-example","produced_by":{"name":"jevdecision","version":"0.2.0"},"questions":{"rare":{"instructions":"Is this a rare event?","type":"noul"},"refund":{"instructions":"Is the customer asking for a refund?","type":"noul"},"tone":{"criteria":{"a":"Plain","é":"Accent","€":"Euro sign","😀":"Emoji","דּ":"Hebrew dagesh"},"instructions":"Which tone fits? Réponse: ✓ 日本語","type":"choice"},"urgency":{"criteria":["low","high"],"instructions":"How urgent is it?","type":"score"}},"record_sha256":"11f9eac90c2bedd5964c954c8248904a46d6b2a97bea2699f5e1237c81cecc4b","response":{"answers":{"rare":{"noul":5e-324,"type":"noul"},"refund":{"type":"refusal"},"tone":{"choice":"a","probabilities":{"a":0.5,"é":0.25,"€":0.125,"😀":0.0625,"דּ":0.0625},"type":"choice"},"urgency":{"probabilities":[1e-7,0.9999999],"score":1,"type":"score"}},"id":"example-canon-1","model":"jev-example","usage":{"credits_used":12}},"schema_version":2,"usage":{"credits_used":12}}
